{
  "loop_id": "BMAT-LOOP-20260612-001",
  "loop_name": "CAR-T IL-21 weekly literature watch",
  "loop_type": "weekly_literature_watch",
  "plugin_version": "1.2.2",
  "status": "complete",
  "public_only": true,
  "private_context_allowed": false,
  "external_tools_allowed": true,
  "connectors_allowed": ["PubMed", "bioRxiv"],
  "human_review_required": false,
  "human_gate_status": "not-required",
  "state_path": ".bmat/loops/BMAT-LOOP-20260612-001/loop_state.json",
  "last_run_at": "2026-06-12T09:00:00+09:00",
  "source_delta_status": "processed",
  "source_delta_summary": "No release-blocking citation deltas remain.",
  "cycle_count": 1,
  "cycle_budget": 3,
  "open_items": [
    {
      "item_id": "LI-001",
      "item_type": "source_delta",
      "status": "resolved",
      "priority": "medium",
      "description": "New PMID candidate screened and excluded as out of scope.",
      "source_ids": ["S-001"],
      "claim_ids": [],
      "owner": "main lead"
    }
  ],
  "reviewer_objections": [
    {
      "objection_id": "OBJ-001",
      "reviewer_role": "citation-verifier",
      "status": "resolved",
      "description": "Citation scope confirmed after source corpus update.",
      "affected_claim_ids": ["CL-001"],
      "required_action": "none"
    }
  ],
  "stop_conditions": [
    "source delta processed",
    "reviewer objections resolved"
  ],
  "stop_status": "stop",
  "output_artifacts": [
    {
      "artifact_id": "OUT-001",
      "path": ".bmat/loops/BMAT-LOOP-20260612-001/source_delta.md",
      "artifact_type": "source_delta",
      "status": "reviewed"
    }
  ],
  "privacy_boundary": "Public-only search terms; no unpublished project detail or PHI/PII used.",
  "notes": "Valid release fixture."
}
